,Unnamed: 0,url,logo,video,name,tag_line,category,rating,reviews_count,developer,website,contact,email,support,details,how_it_works_with_quick_books,key_benefits,pricing_text,plans,similar,FAQs,date,time
125,125,https://quickbooks.intuit.com/app/apps/appdetails/StripeSyncAcodei,https://attachments.developer.intuit.com/appcard-c4a76261-14ef-4dd9-ada8-8e4b2490952a.png,https://www.youtube.com/embed/T63cAqZyTms?rel=0,Stripe Sync by Acodei,Sync your Stripe transactions with QuickBooks Online - affordable and easy!,Sync Data,4.7,40,Acodei,https://www.acodei.com,281-803-9172,support@acodei.com,https://www.acodei.com/,"Our app is built for anyone, from business owners to accountants. Use our step-by-step onboarding to set up everything you need. Connect your Stripe and QuickBooks Online accounts for easy, automated syncing. Instead of just seeing a lump Stripe Transfer in your account, you will see each transaction broken down with customer information, date of sale, Stripe fees, and description. This is particularly useful if you are trying to track customer data or daily transaction data in QuickBooks. Customize the data flow how you like to see it in QuickBooks, and don't waste your time with manual accounting processes.","When you first connect your QuickBooks Online account, you will be led to our step-by-step onboarding process. There you can connect your Stripe account and set up all of the mapping for products and accounts. After completing the onboarding process, we will automatically sync your transactions as they come in from Stripe. You simply need to continue to monitor your bank statements, matching deposits as they come through.","Sales and Refund Syncing: As you receive transactions through Stripe, our app syncs your transactions by creating Sales and Refund Receipts in QuickBooks in real time. These receipts will contain transaction details from Stripe, including fees.
Payout Syncing: As you receive payouts/withdrawals, our app creates a Bank Deposit or Expense for you that pre-selects your Sales and Refund Receipts. You get a matched deposit for every Stripe payout.
Historical Transactions: Sync previous months worth of data seamlessly, and view your data feed to make sure all data has properly synced. Historical syncing is available for $10 per historic month.","Free trial up to 30 transactions per month, no credit card required.
Monthly plans - $9 a month for up to 1,000 transactions, $19 a month up to 10,000.
Historic syncing is $10 per historic month for up to 1,000 transactions a month.","[{'plan-name': 'Free Trial', 'details': 'Syncs will be limited to 30 transactions per month, but there is no time limit on the free trial of our app. Great for startups and early companies, or to test our app. Add Unlimited companies. Historical data available for all tiers.', 'users': 'Unlimited', 'price': '0'}, {'plan-name': 'Standard', 'details': 'Up to 1,000 transactions per month and payouts syncing between Stripe and QuickBooks. Perfect for most small businesses. Add Unlimited QuickBooks Companies, Stripe accounts, and products.', 'users': 'Unlimited', 'price': '$9 / month'}, {'plan-name': 'Premium', 'details': 'Up to 10,000 transactions and payouts syncing between Stripe and QuickBooks. Great for accounting firms or entrepreneurs with multiple companies. Add Unlimited QuickBooks Companies, Stripe accounts, and products. Receive premium support.', 'users': 'Unlimited', 'price': '$19 / month'}]","[{'name': 'Shopify Connector by Intuit', 'tag-line': 'Automatically sync eCommerce sales', 'url': 'https://quickbooks.intuit.com/app/apps/appdetails/quickbooks_online_with_shopify'}, {'name': 'WooCommerce Connector by Intuit', 'tag-line': 'Automatically sync eCommerce sales', 'url': 'https://quickbooks.intuit.com/app/apps/appdetails/quickbooks_online_with_woocommerce'}, {'name': 'Ecommerce Connector', 'tag-line': 'Multichannel Sync with Amazon, Shopify, WooCommerce, Etsy, & More', 'url': 'https://quickbooks.intuit.com/app/apps/appdetails/webgility'}, {'name': 'Synder', 'tag-line': 'Sync Shopify, Stripe, PayPal, Square, eBay, Etsy and Amazon in one place', 'url': 'https://quickbooks.intuit.com/app/apps/appdetails/synder'}]","[{'question': 'Why did you create this app?', 'answer': 'In our own companies, we struggled to break down data in QuickBooks because Stripe came in lump sum payouts. So we created an internal tool first and replicated it over to a public app for your use. Our app now has multi-company support, so it is a great tool for accounting firms and small business owners who want to manage Stripe data, even among multiple entities. Trust us, it solves a lot of headaches.'}, {'question': 'How can I get support?', 'answer': 'We are US-based and will respond to inquiries based on subscription tier within 24 hours during the work week, or even jump on the phone for a quick call. Please email us at support@acodei.com. We really want this app to work for you and we guarantee it will.'}, {'question': 'Does this work for multiple businesses and accounting firms?', 'answer': 'Yes, our app works for one user to add multiple entities under one account. This is perfect for accounting firms who manage multiple clients who use stripe regularly.'}, {'question': 'How do you pronounce Acodei?', 'answer': ""uh-code-eye. It's tough coming up with a business name, am I right?""}]",2021-11-04,08:39:36 AM
126,126,https://quickbooks.intuit.com/app/apps/appdetails/gusto,https://attachments.developer.intuit.com/appcard-631bbc8c-19d3-4aa7-8c19-0580a66d1511.png,https://www.youtube.com/embed/9lZsIKkZyM0?rel=0,Gusto,"Payroll, benefits, and HR built for small businesses",Run Payroll,4.2,380,Gusto,https://gusto.com,(800) 936-0383,support@gusto.com,http://support.gusto.com/,"With the best payroll for small business – plus workers’ comp, benefits, 401(k), and HR tools – Gusto makes it easy for you to pay your employees and take care of your team. Join the 40,000+ businesses in all 50 states that choose Gusto. And when you integrate Gusto with QuickBooks, every time you run payroll, wages and taxes are synced. 9 out of 10 customers say Gusto is easier to use than other payroll solutions. We guide you through setup, whether you are new to payroll or switching providers, and explain things in English – not IRS. That’s why 4 out of 5 customers report fewer payroll errors after switching to Gusto.","Each time you run payroll, cancel payroll, or make a correction, your total wages, taxes, and reimbursements will automatically appear in the expenses section of your QuickBooks Online account. If you are a first time Gusto user, we’ll pull in your company and employee data from QuickBooks Online to streamline your setup process.","Make payroll a breeze: 72% of our customers spend 5 minutes or less to run payroll. And with automatic federal, state and local tax filings and W-2s, you can leave the paperwork to us.
Expert support when you need it: Our friendly, experienced reps are available by phone, email or chat. And whenever you call or chat with us, you’ll be speaking directly with one our San Francisco- or Denver-based team members.
Online employee accounts: Employees fill out their own bank details and W-4s. They also get lifetime accounts to access their pay history and W-2s and can update their own information—which means you deal with fewer questions and less paperwork.","Starting at $45 per month, with the first month free after you run your first payroll","[{'plan-name': 'Core', 'details': 'Full-service payroll so you can get back to what matters most. Includes: full-service payroll, employee accounts, benefits and workers’ comp administration. For more details visit gusto.com/pricing', 'users': '1', 'price': '$39/mo base + $6/mo per person'}, {'plan-name': 'Complete', 'details': 'Full-service payroll plus better HR tools so you can create a great place to work. Includes: offers and onboarding, time-off management, employee directory, full-service payroll, benefits and workers’ comp administration. gusto.com/pricing', 'users': '1', 'price': '$39/mo base + $12/mo per person'}, {'plan-name': 'Concierge', 'details': 'Full-service payroll and HR tools plus certified HR pros and resources so you don’t have to go it alone. Includes: certified HR pros, HR resource center, dedicated support, HR tools, payroll, benefits & workers’ comp administration. gusto.com/pricing', 'users': '1', 'price': '$149/mo base + $12/mo per person'}]","[{'name': 'QuickBooks Payroll, HR & Benefits', 'tag-line': 'The #1 payroll provider for small businesses', 'url': 'https://quickbooks.intuit.com/app/apps/appdetails/QBOP'}, {'name': 'RUN Powered by ADP®', 'tag-line': 'Save time with seamless 2-way integration between payroll and QuickBooks Online!', 'url': 'https://quickbooks.intuit.com/app/apps/appdetails/run_powered_by_adp'}, {'name': 'Payroll by Patriot Software', 'tag-line': 'Simple, affordable payroll that integrates with QuickBooks Online.', 'url': 'https://quickbooks.intuit.com/app/apps/appdetails/PatriotSoftware'}, {'name': 'Paychex Link and Sync', 'tag-line': 'Integration; fast, easy and secure', 'url': 'https://quickbooks.intuit.com/app/apps/appdetails/Paychex_Link_and_Sync'}]","[{'question': 'Which states does Gusto support?', 'answer': 'Gusto offers payroll services in all 50 states and the District of Columbia.'}, {'question': 'What specific payroll services do you provide?', 'answer': 'Gusto offers full-service, online payroll which includes automatic federal, state and local payroll tax calculation, payment and filing; state new hire reporting; direct deposit; contractor payments;  reimbursements and benefits; employee accounts plus online onboarding; integrations with accounting software, time & attendance, and more; payroll reports; and unlimited live support by email, phone or chat. For the full list of payroll features, check out gusto.com/payroll-features'}, {'question': 'How does Gusto handle benefits like medical insurance or 401(k)?', 'answer': 'You can easily add company-wide or employee-specific benefits deductions in Gusto, and we’ll take care of the necessary tax calculations. You can also add and manage benefits through Gusto–such as health insurance, 401(k), commuter benefits, and more–and we’ll automatically keep deductions up-to-date and in sync with payroll.'}, {'question': 'Where can I see a longer FAQ?', 'answer': 'To learn more, visit gusto.com/faq'}]",2021-11-04,08:39:36 AM
127,127,https://quickbooks.intuit.com/app/apps/appdetails/PatriotSoftware,https://attachments.developer.intuit.com/appcard-2f81d51b-9359-4d0d-bcc6-b705509b3ee5.png,https://player.vimeo.com/video/68329507,Payroll by Patriot Software,"Simple, affordable payroll that integrates with QuickBooks Online.",Run Payroll,4.5,57,Patriot Software,http://www.patriotsoftware.com,877-968-7147,support@patriotsoftware.com,https://www.patriotsoftware.com/about/contact/,"Patriot understands the challenges that face small business owners every single day, because over 30 years ago, it clawed and scratched through a painful startup process of its own. CEO Mike Kappel started Patriot in the basement of factory that had no heat or air conditioning. Customers never visited -- the only frequent visitors came in the form of rats and snakes. 

That's when the inspiration to provide small businesses with an easy, affordable payroll software was born. Patriot's mission is to take the stress of payroll away from American small businesses. Sign up today for a free, no-obligation trial and find out for yourself.","Pay your employees easily in 3-simple steps and automatically sync your payroll data with your QuickBooks Online account. The moment you finish your payroll, we'll trigger the automation that logs your payroll entries into your QBO account. You won't have to do a thing.","Run your payroll faster, easier, and more affordably with Patriot Payroll. Our secure, online system allows you to run your payroll in minutes from any device connected to the internet: all without the hassle of maintaining any updates or tax tables.
Enjoy our hassle-free setup. Setting up or switching to a new payroll system can be a pain, so that's why Patriot offers complete payroll and account setup, free of charge. That includes employee setup and all year-to-date payroll info.
Never get frustrated with your payroll again. Patriot offers free, US-based expert support to its customers.",Patriot Software offers a 30-day free trial. Plans start at just $10/month. No contracts and no hidden fees.,"[{'plan-name': 'Basic Payroll', 'details': 'Run your payroll using our secure online system, and we will provide you with all the necessary data to deposit and file your own payroll taxes.', 'users': '1', 'price': '$10/month + $4 per employee'}, {'plan-name': 'Full Service Payroll', 'details': 'You run payroll and we will handle the payroll tax payments and filings for you.', 'users': '1', 'price': '$30/month + $4 per employee'}, {'plan-name': 'Time & Attendance', 'details': '100% online time and attendance system. Integrates with Patriot’s Basic and Full Service Payroll. Employees clock-in and clock-out online. Track employee attendance and time off. No more time clocks!', 'users': '1', 'price': 'Add-on: $5/month for 1 employee + $1 per additional employee'}, {'plan-name': 'Pro Advisor', 'details': 'Accounting professionals receive special pricing by becoming a Certified Advisor with Patriot Software.  Sign up at https://www.patriotsoftware.com/about/partner/advisor/', 'users': '1', 'price': 'Special Pricing'}]","[{'name': 'QuickBooks Payroll, HR & Benefits', 'tag-line': 'The #1 payroll provider for small businesses', 'url': 'https://quickbooks.intuit.com/app/apps/appdetails/QBOP'}, {'name': 'Gusto', 'tag-line': 'Payroll, benefits, and HR built for small businesses', 'url': 'https://quickbooks.intuit.com/app/apps/appdetails/gusto'}, {'name': 'RUN Powered by ADP®', 'tag-line': 'Save time with seamless 2-way integration between payroll and QuickBooks Online!', 'url': 'https://quickbooks.intuit.com/app/apps/appdetails/run_powered_by_adp'}, {'name': 'Paychex Link and Sync', 'tag-line': 'Integration; fast, easy and secure', 'url': 'https://quickbooks.intuit.com/app/apps/appdetails/Paychex_Link_and_Sync'}]","[{'question': 'How long does it take to pay employees with the software?', 'answer': ""With our payroll system, you can pay your automate your payroll with a simple three-step process that shouldn't take more than a few minutes.""}, {'question': 'What QuickBooks data can be integrated with this app?', 'answer': 'Each time you run a payroll, your wages, employee and employer taxes, deductions, and contributions will automatically sync with your QuickBooks Online account.'}, {'question': 'How do I know the payroll and tax calculations will be accurate?', 'answer': 'Patriot guarantees payroll tax calculations are 100% accurate.'}, {'question': 'What are the payment methods offered by Patriot Software?', 'answer': 'You can either issue paper printed or handwritten checks to your employees, or use our free direct deposit.'}]",2021-11-04,08:39:36 AM
128,128,https://quickbooks.intuit.com/app/apps/appdetails/Paychex_Link_and_Sync,https://attachments.developer.intuit.com/appcard-4533fa32-d4b8-4682-bc93-5beeed54d667.jpg,,Paychex Link and Sync,"Integration; fast, easy and secure",Run Payroll,3.7,65,Paychex Inc.,https://www.paychex.com,1-877-456-6317,GLCA@Paychex.com,http://training.paychex.com/sites/training/files/training/generalledger/library/flex-gl-quickbooks-online-integration.pdf,"The Paychex General Ledger service through Link and Sync provides clients and accountants ease in synchronizing QuickBooks Online and Paychex Flex Payroll items.   With each payroll , payroll transactions will automatically transfer to QuickBooks Online.","Paychex, Inc. is a leading provider of integrated solutions for payroll, HR, retirement, and insurance services, empowering business owners to focus on the growth and management of their business. With Paychex General Ledger Service, you can securely post payroll entries to your Intuit  accounting package in just seconds.","Time savings – No more time-consuming, manual entry. Payroll data automatically posts to your QuickBooks Online account so you don’t have to.
Convenience – A seamless flow of general ledger information into QuickBooks Online that is accurate and secure .
Peace of mind – Paychex GLS support is available Monday to Friday, 8 a.m. to 8 p.m. ET, at 877-456-6317.",General Ledger Services are included as part of the Paychex Bundled services with no incremental charges.,"[{'plan-name': 'Paychex Flex Pro Bundle', 'details': 'An all-inclusive set fee per employee for 15+ product including General Ledger Service', 'users': 'Unlimited', 'price': '0'}, {'plan-name': 'Paychex Flex Enterprise Bundle', 'details': 'An all-inclusive set fee per employee for 20 + product including General Ledger Service', 'users': 'Unlimited', 'price': '0'}]","[{'name': 'QuickBooks Payroll, HR & Benefits', 'tag-line': 'The #1 payroll provider for small businesses', 'url': 'https://quickbooks.intuit.com/app/apps/appdetails/QBOP'}, {'name': 'Gusto', 'tag-line': 'Payroll, benefits, and HR built for small businesses', 'url': 'https://quickbooks.intuit.com/app/apps/appdetails/gusto'}, {'name': 'RUN Powered by ADP®', 'tag-line': 'Save time with seamless 2-way integration between payroll and QuickBooks Online!', 'url': 'https://quickbooks.intuit.com/app/apps/appdetails/run_powered_by_adp'}, {'name': 'Payroll by Patriot Software', 'tag-line': 'Simple, affordable payroll that integrates with QuickBooks Online.', 'url': 'https://quickbooks.intuit.com/app/apps/appdetails/PatriotSoftware'}]","[{'question': 'Is there an additional fee for Paychex General Ledger Services?', 'answer': 'General Ledger Services are included in the bundled packages with Paychex payroll services at no  additional costs for the product or the integration.'}, {'question': 'What information is required for setting up the Integration with QuickBooks Online?', 'answer': 'On-boarding the General Ledger service will require minimal information, including a brief checklist and the chart of Accounts from QuickBooks Online.  This information will be obtained at Payroll setup or by calling  1-877-456-6317.'}]",2021-11-04,08:39:36 AM
129,129,https://quickbooks.intuit.com/app/apps/appdetails/Square_Payroll,https://attachments.developer.intuit.com/appcard-5105d690-69e4-4af4-adf7-0e8127f9c26e.png,https://www.youtube.com/embed/w8wkvZFM1JY?rel=0,Square Payroll,The online payroll service trusted by small businesses,Run Payroll,3.4,76,Square,http://www.squareup.com,1-800-573-4003,payroll@help-messaging.squareup.com,https://squareup.com/help/us/en/topic/295,"Square Payroll is the online payroll service trusted by small businesses. It doesn’t matter whether you’re new to payroll or switching from another provider, it’s our mission to make payroll the easiest thing to do on your list. With Square Payroll, you can pay employees, contractors, or both online in just a few clicks. We handle your tax filings and payments to the IRS and state tax agencies.",Send your Square Payroll data to QuickBooks Online to simplify your bookkeeping and get a real-time view of your business finances. Customize how your data is mapped and have it synced automatically or manually.,"Worry-free compliance: We handle your payroll tax filings, payments and withholdings.
Timecard integration: Import hours from Square Point of Sale or partner apps.
Fair, flexible pricing: Only pay for what you use. No hidden fees or charges.",Flexible pricing that matches the number of people you pay per month.,"[{'plan-name': 'Employees and Contractors', 'details': 'Pay employees and contractors. You’re charged per team member you pay each month. Pay them as many times as you need each month at no additional cost.', 'users': 'N/A', 'price': '$35 subscription/month + $5 per employee or contractor paid/month'}, {'plan-name': 'Contractors Only', 'details': 'Pay contractors only. You’re charged per contractor you pay each month. Pay them as many times as you need each month at no additional cost.', 'users': 'N/A', 'price': '$0 subscription/month + $5 per contractor paid/month'}]","[{'name': 'QuickBooks Payroll, HR & Benefits', 'tag-line': 'The #1 payroll provider for small businesses', 'url': 'https://quickbooks.intuit.com/app/apps/appdetails/QBOP'}, {'name': 'Gusto', 'tag-line': 'Payroll, benefits, and HR built for small businesses', 'url': 'https://quickbooks.intuit.com/app/apps/appdetails/gusto'}, {'name': 'RUN Powered by ADP®', 'tag-line': 'Save time with seamless 2-way integration between payroll and QuickBooks Online!', 'url': 'https://quickbooks.intuit.com/app/apps/appdetails/run_powered_by_adp'}, {'name': 'Payroll by Patriot Software', 'tag-line': 'Simple, affordable payroll that integrates with QuickBooks Online.', 'url': 'https://quickbooks.intuit.com/app/apps/appdetails/PatriotSoftware'}]","[{'question': 'What if I don’t use Square today?', 'answer': 'You can sign up for Square Payroll even if you do not have an existing Square account. We do not require you to process credit cards through Square to use Square Payroll.'}, {'question': 'Where can I see more FAQs?', 'answer': 'See all FAQs.'}]",2021-11-04,08:39:36 AM
