,Unnamed: 0,url,logo,video,name,tag_line,category,rating,reviews_count,developer,website,contact,email,support,details,how_it_works_with_quick_books,key_benefits,pricing_text,plans,similar,FAQs,date,time
43,43,https://quickbooks.intuit.com/app/apps/appdetails/collbox,https://attachments.developer.intuit.com/appcard-4722666e-47fa-45a4-8935-c975b5fac250.png,https://www.youtube.com/embed/Kw8leHQNEFY?rel=0,CollBox,A/R management and past-due invoice collections.,Receive Payments,4.7,40,CollBox Inc.,https://collbox.co,512-572-6518,support@collbox.co,https://help.collbox.co/,"Speed up your collection of unpaid invoices using CollBox to identify past-due accounts that need extra attention.

Your dedicated A/R professional will represent your company and be the human touch that is proven to collect faster than any automated messages.

Monitor status with the CollBox real-time dashboard to see which accounts need support and when you should expect payment.

CollBox will facilitate payment so you can keep focusing on running your business.","CollBox connects directly with your QuickBooks account and pulls invoice records into a real-time dashboard that identifies which accounts are past-due and require additional attention.  Depending on the age of the unpaid invoice, CollBox provides 2 products (Assist & Collect) that help you collect and get paid fast.  Whether a customer has a recently past-due invoice and just needs a friendly reminder (Assist) or you have a seriously past-due invoice (90+ days) that requires Collections support (Collect), CollBox has you covered.","Save time: Tracking down payments from customers is not the best use of your time, let CollBox follow up with your customers directly in a professional manner that works and gets you paid fast.
Accurate and reliable data: Real-time dashboard identifies which accounts are past-due recommends the best approach to collect on your unpaid invoice, whether it's sending to collections or just some A/R support.
Get paid faster: The ultimate goal is for you to get paid as fast as possible.  With our proven A/R techniques, you will collect your past-due invoices in record time.","2 products for collecting unpaid invoices.
Collect - For 90+ day invoices. Zero risk, no upfront cost. We get paid from the Collection Agency fees.
Assist - Get a dedicated AR professional, starting at $250/mo. You keep 100% of the collected invoice.","[{'plan-name': 'Collect', 'details': 'Collect - For seriously past-due invoices (90+ days) that need Collections support. This option is 100% free to try with no upfront cost. We only get paid if you Collection and we take our fee directly from the Collection Agency fees.', 'users': 'Unlimited', 'price': 'Free to use.'}, {'plan-name': 'Assist', 'details': 'Get a dedicated AR professional, starting at $250/mo. You keep 100% of the collected invoice.', 'users': 'Unlimited', 'price': 'Starting at $250/ month'}]","[{'name': 'Freedom Merchants', 'tag-line': 'Payment Processing & Invoicing. Totally Integrated with QuickBooks Online.', 'url': 'https://quickbooks.intuit.com/app/apps/appdetails/FMC'}, {'name': 'Bill & Pay', 'tag-line': 'Invoice, ACH & CC payments, any merchant account, auto-pay, customer portal', 'url': 'https://quickbooks.intuit.com/app/apps/appdetails/Bill and Pay'}, {'name': 'Chaser', 'tag-line': 'Automate invoice chasing and streamline your accounts receivable process', 'url': 'https://quickbooks.intuit.com/app/apps/appdetails/chaser'}, {'name': 'Expensify', 'tag-line': 'The only receipt tracking and expense management partner of the AICPA', 'url': 'https://quickbooks.intuit.com/app/apps/appdetails/expensify'}]","[{'question': 'How does it work?', 'answer': 'When you login to CollBox and connect your QuickBooks Online account, we check the status of your current invoices, analyze and organize them using a variety of metrics and recommend the best approach for each account to get paid for your hard work.'}, {'question': 'Why is CollBox better than handling it myself?', 'answer': ""No one likes to track down payments from customers, but you need the cash to operate your business. CollBox does the heavy lifting, whether it's recently past-due invoices that just need a professional and customer-friendly nudge or a delinquent customer that needs a vetted and professional collections agency to reach out.  CollBox is designed to leverage proven strategies to get you paid for your work, fast!""}, {'question': 'How does CollBox fit into my existing A/R workflow?', 'answer': ""You didn't get into business to chase unpaid invoices. CollBox picks up right where the other services you use to prevent delinquent accounts leave off. Once you're ready to start collecting on past due invoices, just sign up for CollBox and start solving your unpaid invoices.""}]",2021-11-04,08:39:36 AM
44,44,https://quickbooks.intuit.com/app/apps/appdetails/capsule,https://attachments.developer.intuit.com/appcard-55ccdefc-a8e2-47cf-af1c-bbf3a3bff27d.png,https://www.youtube.com/embed/KVWPKcOWvsY?rel=0,Capsule CRM,"We make CRM simple yet powerful. Stay organized, save time and make more sales.",Manage Customers,4.5,43,Capsule,https://capsulecrm.com,,support@capsulecrm.com,https://capsulecrm.com/support/,"With Capsule's integration you'll be able to:
Create an invoice or estimate automatically populated with customer details.See open or outstanding invoices next to your customer information and their full history.View the total amount of paid invoices and a detailed summary of past invoices and estimates.

Full feature list
Contact management and email storageActivity tracking with calendar & tasksCase managementFile storageSales pipeline & lead managementReportsAccess controlMobile AppGmail Add-on",Capsule automatically syncs your customers from QuickBooks so you have all the information you need in one place. Any changes made in Capsule will instantly update your data in QuickBooks.,"Capsule makes CRM simple for over 10,000 businesses around the world. We’ll help you manage your contacts, sales and customer relationships with ease, helping your business grow. You’ll be more focused, efficient and productive.
Easy to use. Our clean and clear design means you can log in and get going in minutes. Everyone from marketing and sales through to finance and project management will love Capsule’s simplicity.
Flexible to suit your needs.Capsule can be quickly customized to suit your business processes and customer data. Whether you’re a global corporation, a startup or anything in between, we’ll help you look after your customers.","30 day free trial for all plans
We love helping our customers grow their business and our friendly, global support team will make sure you get the most value out of Capsule.","[{'plan-name': 'Professional', 'details': 'Ideal for expanding businesses.', 'users': 'Unlimited', 'price': '$18/user'}, {'plan-name': 'Teams', 'details': 'Ideal for growing businesses.', 'users': 'Unlimited', 'price': '$36/user'}]","[{'name': 'Method:CRM', 'tag-line': 'The Most Customizable CRM for QuickBooks', 'url': 'https://quickbooks.intuit.com/app/apps/appdetails/method_crm'}, {'name': 'Insightly CRM', 'tag-line': 'CRM & Project Management for QuickBooks Online. Easy. Powerful. Affordable.', 'url': 'https://quickbooks.intuit.com/app/apps/appdetails/app-b7pd7emnbz'}, {'name': 'Donor Receipts', 'tag-line': 'Generate Donation Receipts based on Legal requirements', 'url': 'https://quickbooks.intuit.com/app/apps/appdetails/dreceipts'}, {'name': 'Acuity Scheduling', 'tag-line': 'Automate client bookings, cancellations, reminders & payments with one click.', 'url': 'https://quickbooks.intuit.com/app/apps/appdetails/Acuity'}]","[{'question': 'Is my QuickBooks data secure in Capsule?', 'answer': 'Yes your data is safe in Capsule. You can read our full data protection policy on our website, we are GDPR compliant too.  You can also secure Capsule with Two Factor Authentication, which secures all your data. You can also assign contacts into teams if you’d like to restrict access to of specific contacts in Capsule, you can do that easily too.'}, {'question': 'Why do I need Capsule?', 'answer': 'Capsule makes CRM simple. It makes you work more efficiently and frees up your time so you can focus on looking after your customers.  The integration with QuickBooks Online is slick too, you only see what you need so your contact information is clean and easy to absorb. You can easily create invoices and estimates all within Capsule, it couldn’t be simpler. If you need a CRM that’s easy to use and gives you a full picture of your customer data, you need to look at Capsule.'}, {'question': 'Will you support me?', 'answer': 'Yes. We have a friendly team based in the UK and US who will help you get the most out of Capsule and answer any questions you might have.'}]",2021-11-04,08:39:36 AM
45,45,https://quickbooks.intuit.com/app/apps/appdetails/crik-it-portal-for-quickbooks,https://attachments.developer.intuit.com/appcard-8f9c6b5c-d48a-461b-a327-53dfb3a4b502.png,https://www.youtube.com/embed/AOGVHbazNaM?&rel=0?rel=0,"Order Entry, Reports, & CRM Portal for reps & B2B - Crik-IT for QuickBooks","Order Entry, Sales Reports, CRM - The Portal to Help You Sell Better",Manage Customers,4.9,37,Crik-IT LLC,https://www.crik-it-portal-for-quickbooks.com,(207) 956-0685,support@crik-it.com,https://www.crik-it-portal-for-quickbooks.com/pages/contact-form.html,"Want your reps & B2B customers to have QuickBooks-based info without having access to your QuickBooks?Want them to enter their own orders?Want to give them another way to pay you?Want to provide your reps & management with sophisticated sales reports, including seeing actual vs targets?Want to track & manage leads?
Do you process warranty claims & want a centralized way to manage this process?

Look no further!
Crik-IT is the app you've been waiting for... Check it out!","The Crik-IT Portal integrates with your QuickBooks Online to make customer and item information available to your Crik-IT portal users.  Inventory availability, customer balance and aging info, invoice history, order status, shipment tracking, & more is available for your users to access anytime.  Changes you make in QuickBooks show up in Crik-IT within 15 minutes.  Orders submitted in Crik-IT show up in your QuickBooks within 5 minutes.  It all happens seamlessly and automatically!","Online Order EntryYour B2B customers & reps can enter orders themselves, reducing ordering errors &  freeing up your staff. Orders go to your QuickBooks automatically as estimates or invoices.
Reduce incoming calls freeing up your staff
B2B customers & reps can answer their own questions & serve themselves: Reprint invoice, Check order status, Look up inventory availability, Print history reports, download your logo & more
Don't let your reps ""fly blind""!
Give your reps instant access to up-to-date sales reports & CRM tools so they can manage their customers strategically.","30 day risk free trial.
Packages start at just $29/month!","[{'plan-name': 'Customer Service Package', 'details': 'Includes 1 in-house user.Additional users can be added and other packages are available...  Click here for more info.', 'users': '1', 'price': '$29/month'}]",[],"[{'question': 'How long does it take to get up and running?', 'answer': ""It's easy!  Depending on the size of your QuickBooks file, you can be up and running in as little as 10 minutes.  And, if you have any problem, just call us or chat with us and we'll walk you through it!""}, {'question': 'If an order is entered in Crik-IT, do I have to enter it manually into my QuickBooks?', 'answer': 'Nope!  Within 0 to 5 minutes of an order being submitted in Crik-IT, it will show up automatically in your QuickBooks as a new estimate (or, optionally, as a new invoice).'}, {'question': 'What if Crik-IT looks really great for us, but we need a little tweak?', 'answer': 'Call us!  We want to know what our users need.  This is how we continue to make Crik-IT better and better... by listening to our users!  Plus we have tons of configuration options that we might be able to tweak to meet your needs.'}, {'question': 'How long has Crik-IT been around?  How many users use Crik-IT?  And what do they use it for?', 'answer': 'Crik-IT was born in 2007.  We have thousands of users accessing Crik-IT on a daily basis.  Tens of thousands of inventory queries, orders entered, warranty claims submitted, sales reports run, invoices printed, and more are done in Crik-IT each year.   See  www.crik-it-portal-for-quickbooks.com for more about how different users use Crik-IT.'}]",2021-11-04,08:39:36 AM
46,46,https://quickbooks.intuit.com/app/apps/appdetails/worketc,https://attachments.developer.intuit.com/appcard-ac2374f8-7c88-4e7b-92c9-7c9e59732de5.png,https://www.youtube.com/embed/9QX5ekOkiXI?rel=0?rel=0,WORKetc,All-in-one CRM + Projects + Billing with QuickBooks integration,Manage Customers,4.8,37,WORKetc,https://www.worketc.com,+ 1 800 322-7860,support@worketc.com,https://support.worketc.com,"Say goodbye to painful integrations and constant switching between multiple costly web apps. WORKetc is the all-in-one cloud-based software solution to manage your growing business from end to end.

With CRM, sales, projects, time tracking, customer support, and more, WORKetc lets your entire business work together on one customizable platform. WORketc grows alongside your company, letting you do what you want and how you want it done. 

Through its extensive activity history module, WORKetc gives you a full running record of the relationships you have with your contacts, from the very first email you sent them to their latest support ticket.","Simply connect QuickBooks Online to WORKetc using your QuickBooks Online login details and you’re ready to run your business from end to end with the one complete business management app. You can sync data between WORKetc and QuickBooks Online automatically in the background or manually, as needed.","Manage your business from end to end - Enhance QuickBooks Online with a complete business management system: CRM, projects, time tracking, customer support, and more, all with one app.
Don’t lose money from out-of-date info - Sync billable details including contact entries from WORKetc to QuickBooks Online and vice versa. Keep contact details always up-to-date.
Accurately capture every billable dollar - Directly export invoices, transactions, and expenses from WORKetc to QuickBooks Online, then sync payments made against WORKetc invoices to QuickBooks Online.",* 14 day free trial * No credit card required *,"[{'plan-name': 'Starter', 'details': 'Everything you need to get started with CRM, Project Management, Billing and more.', 'users': '2', 'price': '$78'}, {'plan-name': 'Team', 'details': 'Includes all features plus Social CRM integration and up to 15GB storage and 10,000 contacts', 'users': '3', 'price': '$195/month + $39/month each extra user'}, {'plan-name': 'Foundations', 'details': 'Includes all features plus contractor portal and brandable customer portal Up to 150GB storage and 20,000 contacts', 'users': '3', 'price': '$395/month + $49/month each extra user'}]","[{'name': 'Method:CRM', 'tag-line': 'The Most Customizable CRM for QuickBooks', 'url': 'https://quickbooks.intuit.com/app/apps/appdetails/method_crm'}, {'name': 'Insightly CRM', 'tag-line': 'CRM & Project Management for QuickBooks Online. Easy. Powerful. Affordable.', 'url': 'https://quickbooks.intuit.com/app/apps/appdetails/app-b7pd7emnbz'}, {'name': 'Donor Receipts', 'tag-line': 'Generate Donation Receipts based on Legal requirements', 'url': 'https://quickbooks.intuit.com/app/apps/appdetails/dreceipts'}, {'name': 'Acuity Scheduling', 'tag-line': 'Automate client bookings, cancellations, reminders & payments with one click.', 'url': 'https://quickbooks.intuit.com/app/apps/appdetails/Acuity'}]","[{'question': 'Does your App support synchronization of invoices from QuickBooks Online to WORK[etc]?', 'answer': 'Phase 1 of our phased release supports only single direction synchronization.  Future releases will provide for 2-way sync and conflict resolution tools.'}, {'question': 'Does you App work for QuickBooks Desktop', 'answer': 'WORK[etc] is a cloud app and we only like building for other cloud apps like QuickBooks Online.  A desktop version is not on our roadmap (so upgrade to QBO already!)'}]",2021-11-04,08:39:36 AM
47,47,https://quickbooks.intuit.com/app/apps/appdetails/Cin7,https://attachments.developer.intuit.com/appcard-0a7dda35-b316-4f8d-b2f0-5ad9f9842350.png,https://www.youtube.com/embed/HjrUK1oBKcg?rel=0,Cin7 Inventory and Order Management,Connected inventory management. Simplified.,Track Inventory,4.0,48,Cin7,https://www.cin7.com,1-509-413-0025,Support@Cin7.com,http://help.cin7.com,"Cin7 keeps your stock in line with orders no matter where you sell or hold your inventory. With inventory management at its core, built-in POS, extensive integration and workflow automation, Cin7 centralizes and streamlines your product-focused business, empowering you to contain costs, optimize stock and maximize margins and cash flow.","Connect in minutes using our QuickBooks Online setup wizard. Once integrated, you can easily synchronize your customers and suppliers, and upload credit notes, sales, purchases, COGS and adjustments from Cin7. You can also download any invoice status and account balances. When a change in cost or return affects an invoice or bill, Cin7 shows you where there is a discrepancy. Finally, if a transaction fails to upload to QuickBooks Online, Cin7 tells you how to fix the error.","ACTUAL COSTING
Track actual costs, not average inventory value, and take advantage of unique features like landed cost tracking. Easily keep invoices up to date when COGS change, for precise gross profit accounting.
EASY SYNCING AND DASHBOARD CONTROL
Upload purchases, sales, COGS, adjustments or credit notes to QuickBooks Online in a single click. You'll see all your transactions in one place and any discrepancies between Cin7 and QuickBooks Online.
SAVE TIME WITH BATCH INVOICING
Cin7 automatically converts sales and purchases to invoices and bills in QuickBooks Online. You can also upload many sales at once, for your POS sales or your online sales, as a single invoice in QuickBooks Online.",Plans starting at $299/month.,"[{'plan-name': 'Starter Package', 'details': 'Features:Inventory Management, Point of Sale, Warehouse Management, B2B eCommerce, eCommerce IntegrationQuickBooks Online IntegrationTotal Connections: 1Support: Email (Premium Support +$150p/m)', 'users': '1', 'price': '$299/month'}, {'plan-name': 'Business, Professional, Enterprise Packages', 'details': 'Customized plan to suit your business. Visit the Cin7 website to book a chat with one of our Business Development Specialists.', 'users': '5', 'price': 'Custom'}]","[{'name': 'SOS Inventory', 'tag-line': 'Inventory, order management, and manufacturing for QuickBooks Online.', 'url': 'https://quickbooks.intuit.com/app/apps/appdetails/sos-inventory'}, {'name': 'Katana Inventory and Manufacturing', 'tag-line': 'Modern manufacturing & inventory software for small and scaling businesses', 'url': 'https://quickbooks.intuit.com/app/apps/appdetails/katana'}, {'name': 'Shopify Connector by Intuit', 'tag-line': 'Automatically sync eCommerce sales', 'url': 'https://quickbooks.intuit.com/app/apps/appdetails/quickbooks_online_with_shopify'}, {'name': 'Ecommerce Connector', 'tag-line': 'Multichannel Sync with Amazon, Shopify, WooCommerce, Etsy, & More', 'url': 'https://quickbooks.intuit.com/app/apps/appdetails/webgility'}]","[{'question': 'Does Cin7 have any how to articles or videos I can view?', 'answer': 'All help videos and articles can be viewed at http://help.cin7.com'}, {'question': 'Where can I view all Cin7 features?', 'answer': 'https://www.cin7.com/software/features/'}, {'question': 'Do you have any customer case studies?', 'answer': 'https://www.cin7.com/customers/case-studies/'}]",2021-11-04,08:39:36 AM
48,48,https://quickbooks.intuit.com/app/apps/appdetails/ordertime,https://attachments.developer.intuit.com/appcard-193a39bf-9977-42dd-a304-a6c9b6900c24.png,https://www.youtube.com/embed/YqyIeN30iTs?rel=0,Order Time inventory,Cloud Inventory and Order Management Platform,Track Inventory,5.0,31,"NumberCruncher.com, Inc.",https://ordertime.com,866-278-6243,support@ordertime.com,https://help.ordertime.com/help,"Clock-like precision and control from anywhere with the cloud.  
From light Manufacturing to Wholesale to eCommerce, Order Time from NumberCruncher provides powerful control over orders, customers, and inventory in a single, easy system from any device, anywhere in the world, anytime, anywhere.","QuickBooks is used for accounting while Order Time is used for operations.   Data that is used by both such as customers and vendors can be added or modified in either program.   

Transactions such as purchase orders and sales orders are maintained in Order Time.  Upon completion, the appropriate posting (e.g. Invoice or Bill) is recorded in QuickBooks. 

Synchronization can be scheduled or on demand.","From purchasing and production to order entry, shipping and warehouse management, Order Time gives you control over orders, customers, and inventory in a single, easy-to-use system accessible from any device, anywhere in the world. anytime.
Centralize customer orders from different sources.  With integration with several best of breed shopping carts system,  automatically import web orders and exports shipping information.
Purchasing and production automation tools ensure inventory levels keeps up with demand.   It takes the guesswork out of shipping.  know which order can ship in an instant.  With shipping integration pick, pack and ship operations run smoothly.",30 day Free Trial.  No credit card required!,"[{'plan-name': 'Standard Subscription Plan', 'details': 'Per user pricing. Paid Training Available.', 'users': '1', 'price': '$50.00'}]","[{'name': 'SOS Inventory', 'tag-line': 'Inventory, order management, and manufacturing for QuickBooks Online.', 'url': 'https://quickbooks.intuit.com/app/apps/appdetails/sos-inventory'}, {'name': 'Katana Inventory and Manufacturing', 'tag-line': 'Modern manufacturing & inventory software for small and scaling businesses', 'url': 'https://quickbooks.intuit.com/app/apps/appdetails/katana'}, {'name': 'Shopify Connector by Intuit', 'tag-line': 'Automatically sync eCommerce sales', 'url': 'https://quickbooks.intuit.com/app/apps/appdetails/quickbooks_online_with_shopify'}, {'name': 'Ecommerce Connector', 'tag-line': 'Multichannel Sync with Amazon, Shopify, WooCommerce, Etsy, & More', 'url': 'https://quickbooks.intuit.com/app/apps/appdetails/webgility'}]","[{'question': 'What version of QuickBooks Online do I need?', 'answer': 'You can use any version of QuickBooks Online with Order Time; however, if you want to sync inventory with QuickBooks Online, which is NOT required, you will need Plus. \n\nOur recommendation is to let QuickBooks Online do what it does best, which is accounting. Let Order Time handle the inventory so there is no real need to have inventory in both places.\n\nLearn more - QuickBooks Integration'}, {'question': ""Tell us about your user's favorite features or benefits of Order Time."", 'answer': 'eCommerce Integrations - ShipStation, BigCommerce, Shopify, PayPal, Magento, WooCommerce, Volusion, 3dcart Custom Labels & Barcoding - Create completely customized labels for your business. Labels can include barcodes, data, any field or descriptor, and QR Codes. Print them without special drivers or 3rd party software.Collaboration Tools - Alerts, Notifications, Tasks, EventsEDI - Amazon, eBay, Walmart, Target, POS, Order Writing, Sales Rep'}, {'question': 'What companies (or users) are the best fit for Order Time?', 'answer': 'Manufacturers, Wholesalers, Retailers and eCommerce businesses from industries such as:Food & Beverage, Food Production, Cosmetics, Medical Devices, Apparel & Fashion, Luxury Goods & Jewelry, Consumer Electronics, Consumer Goods, Electrical/Electronic Manufacturing, Mechanical or Industrial Engineering, Hardware, Tools & Specialty Manufacturing. They usually need lot or serial number tracking, expiry dates, Bill of Materials, Assemblies, Kits, Consignment, and more.'}, {'question': 'What was the main problem you were trying to solve when you first developed Order Time?', 'answer': 'How can a small business that involves manufacturing, wholesale, or eCommerce have complete control over orders, customers, and inventory within one app - Accessible from any device, anywhere in the world? Order Time gives you enterprise-level features at a small business price, powerful integrations, complete customization, and top-down control. View our Order Time Main Page.'}]",2021-11-04,08:39:36 AM
