,Unnamed: 0,url,logo,video,name,tag_line,category,rating,reviews_count,developer,website,contact,email,support,details,how_it_works_with_quick_books,key_benefits,pricing_text,plans,similar,FAQs,date,time
88,88,https://quickbooks.intuit.com/app/apps/appdetails/fathom,https://attachments.developer.intuit.com/appcard-5d3b8c1c-bf81-4d84-b206-b198ffab9cd6.png,https://www.youtube.com/embed/h9mXhamuV2Y?rel=0,Fathom,Insightful dashboards and performance reports for your business.,Perform Analytics,4.3,286,Fathom,http://www.fathomhq.com,+1 844 944 9328,support@fathomhq.com,http://support.fathomhq.com/,"Fathom is a financial analysis and management reporting tool which helps you to assess business performance, monitor trends and identify improvement opportunities. Creating insightful analytics, reports and dashboards has never been easier!

Fathom enables you to measure and monitor the financial and non-financial metrics which matter most to your business. Whether you call it business intelligence, performance management, or analytics... the goal of Fathom is the same: to help you understand what's happening in your business and how to take action when needed.",Fathom seamlessly integrates with QuickBooks Online and then transforms your accounting data into actionable business intelligence and visual performance reports.,"Fathom provides a suite of in-depth analysis tools and metrics which help you see exactly how well your business is performing. These tools and metrics help to assess profitability, cash flow, growth and other key performance indicators (KPIs).
Whether reporting to lenders or updating your management team - Fathom has your reporting needs covered! Easily create and customize monthly, quarterly and annual reports. Build templates to share and reuse across all your clients.
Fathom also optionally helps you easily compare, rank and benchmark your companies, clients or franchisees. Or group related companies together to create consolidated reports for an organization. Great for franchises and multi-entity organisations!","Free 14 Day Trial
No Credit Card required
Plans from $44/ month","[{'plan-name': 'Starter', 'details': '1 company included. Additional companies $44 each.', 'users': 'Unlimited', 'price': '$44 per month'}, {'plan-name': 'Silver', 'details': '10 companies included. Additional companies $25 each.', 'users': 'Unlimited', 'price': '$225 per month'}, {'plan-name': 'Gold', 'details': '25 companies included. Additional companies $11 each.', 'users': 'Unlimited', 'price': '$325 per month'}, {'plan-name': 'Platinum', 'details': '50 companies included. Additional companies $9 each.', 'users': 'Unlimited', 'price': '$575 per month'}]","[{'name': 'Syft Analytics', 'tag-line': 'Reports | Graphs | Consolidations | Forecasts | Valuations | Benchmark | Classes', 'url': 'https://quickbooks.intuit.com/app/apps/appdetails/syft'}, {'name': 'Reach Reporting - Analytics, Report Builder, Dashboards, Consolidations, Classes', 'tag-line': 'Financial Reporting, Classes, Consolidations, Dashboards, Performance Analytics', 'url': 'https://quickbooks.intuit.com/app/apps/appdetails/reach_reporting'}, {'name': 'Qvinci - Consolidation, BI, KPIs and Financial Reporting', 'tag-line': '#1 Reporting App in the Intuit Store', 'url': 'https://quickbooks.intuit.com/app/apps/appdetails/qvinci'}, {'name': 'LivePlan', 'tag-line': 'Budgeting, forecasting & financial dashboards that help small businesses grow.', 'url': 'https://quickbooks.intuit.com/app/apps/appdetails/liveplan'}]","[{'question': 'Is there a minimum term?', 'answer': 'No, Fathom is a monthly pay as you go service with no contracts. If you decide to cancel, your subscription will not renew at the end of your monthly billing cycle.'}, {'question': 'Are there per-user fees?', 'answer': 'No, the prices above are inclusive of an unlimited number of users.'}, {'question': 'How can I pay for Fathom?', 'answer': 'We accept payments via Visa, MasterCard and AMEX.'}, {'question': 'Can I view a demo company?', 'answer': 'Yes, there is a demo company available for use within Fathom.'}]",2021-11-04,08:39:36 AM
89,89,https://quickbooks.intuit.com/app/apps/appdetails/syft,https://attachments.developer.intuit.com/appcard-871e8540-3459-4c93-be48-29074fe8b2d9.png,https://www.youtube.com/embed/KA_NuNbxwc4?rel=0,Syft Analytics,Reports | Graphs | Consolidations | Forecasts | Valuations | Benchmark | Classes,Perform Analytics,4.8,222,Syft Analytics,https://www.syftanalytics.com,+1 650 651 5470,support@syftanalytics.com,https://www.syftanalytics.com/help/?ref=quickbooks,Syft is an award-winning financial reporting and analytics app that allows accountants and businesses to easily create beautiful financial reports and insights.,"Syft Analytics seamlessly integrates with QuickBooks Online and transforms your accounting data into financial reports and insights. The Syft and QuickBooks Online integration unlocks all functionality available in Syft including Report, Visualize, Consolidate, Forecast, Budget, Valuations, Tax and Benchmark. All features can be combined into custom PDF report packs. Syft’s plug-and-play interface requires no training or setup with reporting available in under 30 seconds. Cash or accrual basis reporting available.","Powerful features to go from data to decisions: Create beautiful reports, visualize data in graphs & dashboards, consolidate multiple entities, compare performance to the industry, create forecasts & budgets and estimate the value of your entity.
Deliver real impact: Accountants and business owners use Syft to increase revenue and reduce costs, improve key performance metrics and save time across all reporting and analytics processes. Setup and ready-to-go in under 30 seconds.
Support to guide your every step: Multi-level support including guided setup and on-boarding, dedicated account managers, dedicated customer success specialists and live-chat assist.","Our free forever basic version is perfect for financial visualizations, management accounts, ratio analysis and cash flow forecasting. Try a 14 day free trial on all paid plans to experience the full feature set. No credit card required.","[{'plan-name': 'Basic', 'details': 'Unlimited QuickBooks Online entities | Financial visualization and performance reports | Management accounts | Ratio analysis | Syft branding | Cash flow forecasting | Knowledge center', 'users': 'Unlimited', 'price': 'Free'}, {'plan-name': 'Essential', 'details': 'Unlimited QuickBooks Online entities | Basic Accountant features | Review, comment, and download PDF report packs | Quick reports and custom reports | Custom branding for accountant and client | Industry benchmarks | Email and chat support', 'users': 'Unlimited', 'price': '$19'}, {'plan-name': 'Professional', 'details': 'Unlimited QuickBooks Online entities | Growing Accountant features | Financial statements | Consolidations | Automated commentary | Scheduled reports | Budget & forecast builder | Custom ratios and KPIs | Valuations | Tax | Personalized success team', 'users': 'Unlimited', 'price': '$39'}]","[{'name': 'Reach Reporting - Analytics, Report Builder, Dashboards, Consolidations, Classes', 'tag-line': 'Financial Reporting, Classes, Consolidations, Dashboards, Performance Analytics', 'url': 'https://quickbooks.intuit.com/app/apps/appdetails/reach_reporting'}, {'name': 'Fathom', 'tag-line': 'Insightful dashboards and performance reports for your business.', 'url': 'https://quickbooks.intuit.com/app/apps/appdetails/fathom'}, {'name': 'Qvinci - Consolidation, BI, KPIs and Financial Reporting', 'tag-line': '#1 Reporting App in the Intuit Store', 'url': 'https://quickbooks.intuit.com/app/apps/appdetails/qvinci'}, {'name': 'LivePlan', 'tag-line': 'Budgeting, forecasting & financial dashboards that help small businesses grow.', 'url': 'https://quickbooks.intuit.com/app/apps/appdetails/liveplan'}]","[{'question': 'Can my team join my free trial?', 'answer': 'Yes, you can invite as many people as you want with varying permissions to join your Syft Analytics trial. Simply navigate to the User tab on the left menu bar and click “Invite user”.'}, {'question': 'Can I add more than one entity on Syft?', 'answer': 'Yes, all plans come standard with unlimited entities. Simply click “Add entity” at the top right of your screen once you’re logged in to connect another entity.'}, {'question': 'Do I have to sign a long term contract?', 'answer': 'No, all plans are on a month-to-month basis. You can cancel at any time with no penalties or additional cancellation fees.'}, {'question': 'Is customer support included?', 'answer': 'Yes, our friendly support team is ready to help out. Get in touch either via live-chat assist at the bottom right of your screen, email or phone.'}]",2021-11-04,08:39:36 AM
90,90,https://quickbooks.intuit.com/app/apps/appdetails/reach_reporting,https://attachments.developer.intuit.com/appcard-588fae58-cd08-4723-b546-2eb8ce351757.jpg,https://www.youtube.com/embed/AS16N8EGlYY?rel=0,"Reach Reporting - Analytics, Report Builder, Dashboards, Consolidations, Classes","Financial Reporting, Classes, Consolidations, Dashboards, Performance Analytics",Perform Analytics,4.9,191,Reach Reporting,https://www.reachreporting.com,+1 (877) 467-7637,support@reachreporting.com,http://help.reachreporting.com,"Advanced financial reporting. Advisory at its finest.

Financial analytics at your fingertips. Construct and refine balance sheets and P&Ls. Insert total rows, modify groupings, add formulas in powerful spreadsheets, and all with live data.

Budgets and forecasts built off of advanced formulas...and always live. Consolidate multiple businesses easily.

Take back your time by creating sticky reports, that stay updated, and refresh the data regularly. Even the text can be live. Now you can build a report once then refine and perfect it over time, rather than rebuilding it and all of its source data every month.

Master your reporting.","Reach Reporting connects to QuickBooks Online and provides easy-to-understand, real-time analysis and reporting of financial performance data. With the built-in dashboards and report builder, it helps connect your financial data from QBO in a seamless process to build the best performance reports for clients.

With the simplicity of connecting your QuickBooks Online, Reach Reporting enables the best performance and financial analytics–all in the finest dashboards and reports. Now you have the power to deliver industry-best reporting in no time!

Astound your clients with master reports.","Instant Reports – Choose from the library of pre-built reports and instantly export to PDF. Annual reports, month-end reports, quarterly reports. Use the included templates or build your own! Take the reporting process from hours down to minutes!
Powerful Financial Analytics – Deliver the message efficiently and cleanly! Delve deep into the company's performance and build formulas, metrics, and KPIs that speak volumes. Advanced spreadsheets make your job easy and they are ALWAYS up-to-date!
Classes and Consolidations – Filter reports or dashboards by class. Consolidated companies easily.  Enhance the client relationship instantly with world-class reports. Live text, live-spreadsheets, live dashboards. Manage tough requests with ease!","Get free access for 30 days to world-class reporting, financial analytics, and unlimited dashboards. Build reports that last. Best-in-class performance analytics with features like classes, consolidations, dashboards and so much more.","[{'plan-name': 'Business', 'details': 'Perfect for intercompany use. Full access to financial analytics, performance tracking reports, dashboards, classes, consolidations, live spreadsheets, forecasting/budgeting for cash flow, and more.\n\nAdd additional companies at $149/each.', 'users': 'Unlimited', 'price': '$149/month'}, {'plan-name': 'Advisor-10', 'details': 'Get 10 companies for less than 2 making the process easy for adding providing this insightful report for all your clients. Build reports, share a client portal from your website, powerful dashboards, and more.\n\nAdditional companies at $29/each.', 'users': 'Unlimited', 'price': '$290'}, {'plan-name': 'Advisor-25', 'details': 'Next level advisory. Reach enables you to start using the power of templates in a big way. Use it to create a powerful report for one client then distribute it to other clients. Extend your reach.\n\nAdditional companies at $22/each.', 'users': 'Unlimited', 'price': '$550'}, {'plan-name': 'Advisor-50', 'details': 'Reach saves you time, yes, but more importantly, it scales your time. Automate the busy work, then focus on the skills you are best at. Leverage the power of Reach to take your firm to the next level. \n\nAdditional companies at $18/each.', 'users': 'Unlimited', 'price': '$950'}, {'plan-name': 'Enterprise', 'details': ""Need something a little more individualized? We got you covered. Get custom pricing for custom applications. Whether it's 1,000 dentists or 10,000 advisory clients, Reach can enable internal processes that are 80%+ more efficient and productive."", 'users': 'Unlimited', 'price': 'Custom'}]","[{'name': 'Syft Analytics', 'tag-line': 'Reports | Graphs | Consolidations | Forecasts | Valuations | Benchmark | Classes', 'url': 'https://quickbooks.intuit.com/app/apps/appdetails/syft'}, {'name': 'Fathom', 'tag-line': 'Insightful dashboards and performance reports for your business.', 'url': 'https://quickbooks.intuit.com/app/apps/appdetails/fathom'}, {'name': 'Qvinci - Consolidation, BI, KPIs and Financial Reporting', 'tag-line': '#1 Reporting App in the Intuit Store', 'url': 'https://quickbooks.intuit.com/app/apps/appdetails/qvinci'}, {'name': 'LivePlan', 'tag-line': 'Budgeting, forecasting & financial dashboards that help small businesses grow.', 'url': 'https://quickbooks.intuit.com/app/apps/appdetails/liveplan'}]","[{'question': 'Does Reach have spreadsheets built-in?', 'answer': 'Yes. Reach Reporting has multiple places where the spreadsheets can be accessed readily. Enhanced functionality enables you to build performance reports that effectively provide your clients with actionable information for their financial analytics. \n\nIn fact, the spreadsheets within Reach can even reference each other to further enhance usability. Pull data from Google Sheets, QBO, datasheets, formulas, budgets, and custom cells.'}, {'question': 'What QuickBooks data is synced with Reach Reporting?', 'answer': ""Reach Reporting pulls the historical balances of your accounts in order to provide analytics and reports of that data. \n\nSpecifically the chart of accounts. Reach uses the information in the COA to build advanced tables and analytics that enhance the client's understanding of their business.""}, {'question': 'Can Reach filter by Classes or Departments?', 'answer': 'Yes, Reach Reporting has the ability to filter by classes or departments. In fact, you have the ability to get granular with the data by creating comps and ratios that enhance the data. Then display it in any chart type to describe the data efficiently.'}, {'question': 'Is my data secure?', 'answer': 'Very. Your data is protected in transit by 256-bit encryption (bank-level encryption) and is stored on high-security 3rd party servers. Reach Reporting regularly verifies that the secure nature of the site is maintained.'}]",2021-11-04,08:39:36 AM
91,91,https://quickbooks.intuit.com/app/apps/appdetails/qvinci,https://attachments.developer.intuit.com/appcard-f64a5c21-9603-4a4a-a925-97cdc16ec029.png,https://www.youtube.com/embed/rknw8ZrZ4hk?rel=0?rel=0,"Qvinci - Consolidation, BI, KPIs and Financial Reporting",#1 Reporting App in the Intuit Store,Perform Analytics,4.5,166,Qvinci Software,https://www.qvinci.com,512-637-7337,support@qvinci.com,https://go.qvinci.com/Start-Trial-QBO,"Whether you have one or thousands of clients (locations), accountants, franchises and multi-unit organizations rely on Qvinci to increase profits and improve operational efficiencies. Access actionable insights though 70+ GAAP complaint reports, business intelligence, KPI building, benchmarking, comparative and vertical analysis, and weekly (4-4-5), multi-period and period-over-period reporting to analyze the metrics that matter most.
View Accountant Report Samples
View Franchise, Diocese and Multi-Unit Report Samples","Qvinci’s patented technology seamlessly integrates with QuickBooks® and affords users near “real-time” access to financial data regardless of file type or location. Single login access to the data you need, when you need it, streamlines workflow and reduces the cost (time) associated with processing files and reporting. Hosted at AWS, your data is safe and secure. Qvinci more than pays for its nominal cost by empowering you with functionality that improves operational efficiency and increases profits Click for more information","Turbo-charges the ability to customize, style, package and publish sophisticated and virtually unlimited business intelligence, KPI’s and financial reports (including integrated charts and graphs) all in near real-time.
Offers an extensive customizable array of visibility into revenue, expenses, and cash for all reporting clients or business locations.
Motivates clients and business units to reach out for assistance in correcting problem areas before they become unmanageable by using red arrows and downward trending charts and graphs.","* Free Chat Support, Initial Setup and Training $ per Office/Business-Unit Depending on Product Purchased. Advanced Training and Custom Reports ($200/hour) are quoted upon request.","[{'plan-name': 'Qvinci for Accountants', 'details': 'Consolidation, Reporting, Business Intelligence, KPIs & Workflow Management Solutions', 'users': 'Unlimited', 'price': '$21.95 per file synced per month. ** Additional charges apply for syncing by Class, GL access and JE management. Account Setup, Training and Onboarding is charged per accounting office. ** Includes 70+ GAAP compliant reports, business intelligence, KPIs, and industry specific jumpstart reporting packages (Including integrated charts and graphs)  Get Started Today!'}, {'plan-name': 'Qvinci for Franchises', 'details': 'All Features Above Configured Specifically for Franchises.', 'users': 'Unlimited', 'price': '$21.95 per file synced per month. **  Get Started Today!'}, {'plan-name': 'Qvinci for Multi-Units', 'details': 'All Features Above Configured Specifically for Diocese and other Multi-Unit Entities.', 'users': 'Unlimited', 'price': '$21.95 per file synced per month.**  Get Started Today!'}]","[{'name': 'Syft Analytics', 'tag-line': 'Reports | Graphs | Consolidations | Forecasts | Valuations | Benchmark | Classes', 'url': 'https://quickbooks.intuit.com/app/apps/appdetails/syft'}, {'name': 'Reach Reporting - Analytics, Report Builder, Dashboards, Consolidations, Classes', 'tag-line': 'Financial Reporting, Classes, Consolidations, Dashboards, Performance Analytics', 'url': 'https://quickbooks.intuit.com/app/apps/appdetails/reach_reporting'}, {'name': 'Fathom', 'tag-line': 'Insightful dashboards and performance reports for your business.', 'url': 'https://quickbooks.intuit.com/app/apps/appdetails/fathom'}, {'name': 'LivePlan', 'tag-line': 'Budgeting, forecasting & financial dashboards that help small businesses grow.', 'url': 'https://quickbooks.intuit.com/app/apps/appdetails/liveplan'}]","[{'question': 'How long does it take to implement Qvinci?', 'answer': 'A typical user with 50-100 files is up and running within hours. Large clients syncing thousands of files can be fully implemented within two weeks.'}, {'question': 'Do I need to have a Standard Chart of Accounts for my entire organization?', 'answer': 'No, you can report from native QuickBooks data. If a SCoA is desired, Qvinci’s patented mapping functionality allows users to group accounts in any fashion while maintaining the structural integrity of the QuickBooks CoA.'}, {'question': 'Does Qvinci work with multiple currencies?', 'answer': 'Qvinci supports multi-currency conversions for QuickBooks Desktop and utilizes XE for conversion rates.'}, {'question': 'Is my data secure with Qvinci?', 'answer': 'Qvinci is a cloud-based solution hosted at AWS, so data stays secure. Data in transit across the Internet is encrypted using 2048-bit SHA2 SSL TLS 1.2. AWS is FIPS, DoD, HIPPA, SOC 1, SOC 2 and SOC 3 compliant.'}]",2021-11-04,08:39:36 AM
92,92,https://quickbooks.intuit.com/app/apps/appdetails/amazonintegration,https://attachments.developer.intuit.com/appcard-e3535e0b-b17b-4fde-8736-8038a9ceb3b6.png,https://www.youtube.com/embed/uHY5P0B1lT0?rel=0,taxomate,Amazon FBA & Marketplace Integration,Sync Data,5.0,125,Taxomate,https://taxomate.com,Book As Required,support@taxomate.com,https://docs.taxomate.com/,"taxomate automatically fetches and processes Amazon settlements, generates journals for each settlement and posts them to QuickBooks Online, automatically. 

Each time Amazon initiates a settlement, taxomate detects it, loads the transactions, and generates a summary of the revenue, expenses and the various other transactions. 

You can also select which accounts and tax rates taxomate should use for each Amazon transaction type or have us do it automatically for you!","taxomate makes it easy for you to import Amazon marketplace transactions into QuickBooks Online. Once imported into QuickBooks you can easily reconcile the transactions with bank deposits received from Amazon. taxomate journals posted to QuickBooks will match perfectly against the corresponding bank deposit from Amazon, saving you countless hours of manually inputting your transaction statements.","taxomate is an automated cloud-based service used by Amazon merchants to import their Amazon sales and fee transactions and to post summarized transactions to QuickBooks Online.
taxomate will automatically find your latest Amazon Seller Marketplace settlements and post summarized transactions to QuickBooks Online.
Track Cost of Goods Sold, Inventory Valuation.",Taxomate plans start at $14 and all plans come with unlimited marketplace connections and users. We can support any order amount.,"[{'plan-name': 'Starter Plan', 'details': 'Import up to 500 orders per month. Unlimited marketplace connections and users.', 'users': 'Unlimited', 'price': '$14'}, {'plan-name': '1K Plan', 'details': 'Import up to 1,000 orders per month. Unlimited marketplace connections and users.', 'users': 'Unlimited', 'price': '$24'}, {'plan-name': '5K Plan', 'details': 'Import up to 5,000 orders per month. Unlimited marketplace connections and users.', 'users': 'Unlimited', 'price': '$44'}, {'plan-name': '10K Plan', 'details': 'Import up to 10,000 orders per month. Unlimited marketplace connections and users.', 'users': 'Unlimited', 'price': '$79'}, {'plan-name': '20K Plan', 'details': 'Import up to 20,000 orders per month. Unlimited marketplace connections and users.', 'users': 'Unlimited', 'price': '$129'}]","[{'name': 'Shopify Connector by Intuit', 'tag-line': 'Automatically sync eCommerce sales', 'url': 'https://quickbooks.intuit.com/app/apps/appdetails/quickbooks_online_with_shopify'}, {'name': 'WooCommerce Connector by Intuit', 'tag-line': 'Automatically sync eCommerce sales', 'url': 'https://quickbooks.intuit.com/app/apps/appdetails/quickbooks_online_with_woocommerce'}, {'name': 'Ecommerce Connector', 'tag-line': 'Multichannel Sync with Amazon, Shopify, WooCommerce, Etsy, & More', 'url': 'https://quickbooks.intuit.com/app/apps/appdetails/webgility'}, {'name': 'Synder', 'tag-line': 'Sync Shopify, Stripe, PayPal, Square, eBay, Etsy and Amazon in one place', 'url': 'https://quickbooks.intuit.com/app/apps/appdetails/synder'}]","[{'question': 'Do you support the QuickBooks Desktop version?', 'answer': 'We do not currently support QuickBooks Desktop at this time. However, we are exploring QuickBooks Desktop integration.'}, {'question': 'How many Amazon Marketplaces can I connect to each account?', 'answer': 'You can connet as many marketplaces as you would like.'}, {'question': 'Which Country Marketplaces do you currently support?', 'answer': 'We currently support the following Amazon Marketplaces: United States, United Kingdom, Canada, Mexico, Italy, France, Germany, Japan, and Australia.'}, {'question': 'Does taxomate import Amazon transactions/orders?', 'answer': 'Yes, we allow you to import all orders information, group by SKU groups, and grouping by transaction type.'}]",2021-11-04,08:39:36 AM
