,Unnamed: 0,url,logo,video,name,tag_line,category,rating,reviews_count,developer,website,contact,email,support,details,how_it_works_with_quick_books,key_benefits,pricing_text,plans,similar,FAQs,date,time
0,0,https://quickbooks.intuit.com/app/apps/appdetails/method_crm,https://attachments.developer.intuit.com/appcard-b6cdb50c-f388-4622-b1f7-d6058598c184.png,https://www.youtube.com/embed/psi37WPzNqc?rel=0,Method:CRM,The Most Customizable CRM for QuickBooks,Manage Customers,4.8,1547,Method Integration Inc.,https://www.method.me,1-888-925-6238,success@method.me,https://help.method.me/,"30-day Free Trial • Unlimited Users & Contacts  • Best-in-class support
Your customer information is kept in a single centralized list, making contact information easily accessible to all team members, so follow-ups happen faster, and customers remain loyal.
Click ‘Get App Now’ and Method will automatically connect with your QuickBooks account and start syncing in seconds. No manual importing or additional integration costs. Access all your contact information and QuickBooks data in one place within minutes.","Method’s patented sync technology has everything you need to win more sales and serve customers all in one place.Method’s sync provides more than just a view of your QuickBooks data — your team is able to edit and add QuickBooks data including Contacts, Sales Transactions, Payments, Vendor Transactions, List Items, and more all from within Method.","Future-proof your company with software that adapts with your business as it evolves.Create workflows that work the way you do. Method’s no-code platform makes it easy to develop a solution or app perfect for your business.
Streamline your sales process, customize your invoices, quotes, and sales orders.With a lead list that everyone shares, your staff always has up-to-date customer information. Use activities to track emails and phone calls.
Contact and Transaction info - All in One PlaceMethod’s two-way, real-time QuickBooks sync consolidates customer history and accounting data, giving everyone a 360-degree view of every customer.Keep QuickBooks clean and error-free!","Sign up for a 30-day free trialNo credit card required to sign up. All Method Subscriptions include our Industry-leading QuickBooks sync and unlimited customizations. Trusted by over 3,000 small businesses.","[{'plan-name': 'FREE 30-day trial of Method:CRM', 'details': 'You and your team can try out ALL of Method:CRM free for 30 days, with no risk. There is no contract to sign and no credit card required for your free trial. After your free trial, your team can mix subscription levels depending on your needs.', 'users': 'Unlimited', 'price': 'FREE'}, {'plan-name': 'Contact Management', 'details': 'For small teams that want to centralize customer communications in one place. Schedule tasks, send emails and share calendars with your entire team.  Give your customers access to self-serve portals.', 'users': 'Unlimited', 'price': '$25/user/month (annual)$28/user/month (monthly)'}, {'plan-name': 'CRM Pro', 'details': 'For larger teams that need to expand the functionalities of QuickBooks Online. Sync and manage invoices, estimates, sales orders and more. Accept online payments. Track opportunities, capture prospects with web-to-lead forms.', 'users': 'Unlimited', 'price': '$44/user/month (annual)$49/user/month (monthly)'}]","[{'name': 'Insightly CRM', 'tag-line': 'CRM & Project Management for QuickBooks Online. Easy. Powerful. Affordable.', 'url': 'https://quickbooks.intuit.com/app/apps/appdetails/app-b7pd7emnbz'}, {'name': 'Donor Receipts', 'tag-line': 'Generate Donation Receipts based on Legal requirements', 'url': 'https://quickbooks.intuit.com/app/apps/appdetails/dreceipts'}, {'name': 'Acuity Scheduling', 'tag-line': 'Automate client bookings, cancellations, reminders & payments with one click.', 'url': 'https://quickbooks.intuit.com/app/apps/appdetails/Acuity'}, {'name': 'Order Entry, Reports, & CRM Portal for reps & B2B - Crik-IT for QuickBooks', 'tag-line': 'Order Entry, Sales Reports, CRM - The Portal to Help You Sell Better', 'url': 'https://quickbooks.intuit.com/app/apps/appdetails/crik-it-portal-for-quickbooks'}]","[{'question': 'What makes Method the best CRM of choice for QuickBooks users?', 'answer': 'The unique combination of Method’s deep QuickBooks sync and no-code customization engine enables businesses to achieve their optimal workflows.'}, {'question': 'I have unique needs — how flexible is Method? What kind of customization do you offer?', 'answer': 'Method can be customized a little or a lot, all without a single line of code. Customize your account using our drag-and-drop customization tools or work with our team of Business Solution Specialists on a pay-per-use basis.'}, {'question': 'Are there additional fees for the QuickBooks sync or to customize my own account?', 'answer': 'No, our QuickBooks integration and customization engine are at the core of our platform and included in your monthly subscription. You can mix subscription levels, paying only for the functions that you need.'}, {'question': 'Can I restrict what financial information my staff can see?', 'answer': 'Yes, Method’s user permissions allow you to determine levels of access for each user.'}]",2021-11-04,08:39:36 AM
1,1,https://quickbooks.intuit.com/app/apps/appdetails/quotient,https://attachments.developer.intuit.com/appcard-c7fe4fc4-fbdb-49b0-b232-dd9d66fdd7da.png,https://player.vimeo.com/video/147057523,Quotient,Online estimating and proposal software,Calculate Quotes,4.7,61,Quotient,https://www.quotientapp.com,,support@quotientapp.com,https://www.quotientapp.com/support,"Quotient is super-intuitive online quoting and proposal software that lets you create, send and manage your quotes. Integrate with QuickBooks Online so that your accepted Quotient quotes automatically appear as invoices.","First, you connect Quotient to your QuickBooks account. You can then enable invoices, so that invoices are automatically created in QuickBooks from accepted Quotient quotes. You can also enable “lookups” for QuickBooks customers and QuickBooks products/services – so that these can be looked up from within Quotient when creating new quotes.","Include Optional and Multiple Choice Items in your quotes. This gives your customers the ability to pick and choose while accepting – they'll even see the total price recalculate.
Create Content Templates for your different types of offerings. Templates make it even quicker to start new quotes from. Templates help to maintain consistency. Templates save you from having to remember what to include every time you quote.
Quotient quotes have an easy click-to-accept process. Your customers will love it!","Free 30 day trial, then two easy to understand plans.","[{'plan-name': 'One Man Band', 'details': 'Suitable for 1 team member', 'users': '1', 'price': '$25 USD per month'}, {'plan-name': 'Business Time', 'details': 'Suitable for 2-5 team members. Additional team members $6 each per month.', 'users': '5', 'price': '$45 USD per month'}]","[{'name': 'GoProposal', 'tag-line': 'Helping Accountancy Firms To Grow More Profitably', 'url': 'https://quickbooks.intuit.com/app/apps/appdetails/GoProposal'}, {'name': 'ContractorTools', 'tag-line': 'Estimating and Invoicing for Construction Contractors (iPhone, iPad, & Mac)', 'url': 'https://quickbooks.intuit.com/app/apps/appdetails/ContractorTools'}, {'name': 'Prospero Proposals', 'tag-line': 'Create online proposals with ease. Impress your clients and win more projects.', 'url': 'https://quickbooks.intuit.com/app/apps/appdetails/prospero'}, {'name': 'Method:CRM', 'tag-line': 'The Most Customizable CRM for QuickBooks', 'url': 'https://quickbooks.intuit.com/app/apps/appdetails/method_crm'}]","[{'question': 'How long does it take to setup Quotient?', 'answer': 'It only takes a few minutes to begin with our 30 day free trial. From there you can create and send your first quote. You can copy a quote to a template, making it even quicker to start your next quote from.'}, {'question': 'Can I have different quote templates?', 'answer': 'Yes, you can build up a collection of quote templates for the different types of jobs/services you regularly quote on. Starting a quote from a template is as simple as choosing a template from the ‘new quote’ drop-down on your dashboard.'}, {'question': 'Can I customize the look of my quotes?', 'answer': 'Yes, there’s a range of things you can modify so that your quotes look more inline with your brand, while maintaining that professional edge. You can upload your company logo, choose from a range of colors (for buttons and links), select a different font (for headings and body text) or choose your preferred quote layout.'}, {'question': 'How does the integration with QuickBooks Online work?', 'answer': 'First you connect Quotient to your QuickBooks account. You can then enable invoices, so that invoices are automatically created in QuickBooks from accepted Quotient quotes. You can also enable “lookups” for QuickBooks customers and QuickBooks products/services – so that these can be looked up from within Quotient when creating new quotes.'}]",2021-11-04,08:39:36 AM
2,2,https://quickbooks.intuit.com/app/apps/appdetails/MoreReporting,https://attachments.developer.intuit.com/appcard-96772e7b-1d92-4396-a5ff-3a0528897b9c.png,https://www.youtube.com/embed/Du5itrc7b_I?rel=0,MoreReporting,"Automated reporting, industry benchmark, and consolidation for QuickBooks",Perform Analytics,4.8,52,MoreReporting,http://www.morereporting.com,+1 (844) 577-8707,support@morereporting.com,https://www.youtube.com/channel/UCv2Lww48i5W3kf2OWA4j4MA,"MoreReporting's cutting-edge technology translates complicated accounting data into enhanced reports and dashboards leading to better business decisions to drive profitability.  Get a detailed overview of your business with our instant Business Health Report that verifies your data towards 30+ benchmarked KPIs within Data Quality, Accounting, Business Performance, Sales & Receivables, Expenses & Payables and Fraud Detection.  Get alerted of any anomalies found in the accounting data to provide advisory services for your clients.",We make integrating with QuickBooks simple and automatic.  After your company has registered with MoreReporting you will be able to authorize the automated integration of QuickBooks data using your username and password.,"Automated financial reports & dashboards help you translate complicated accounting data instantly.  Unlimited classes & locations included.  Drillable transactional data with customizable dashboards.  Turn financial reporting into management advice.
MoreReporting uses industry benchmarks to help you identify deviations from standards & trends, empowering you to be a trusted advisor.  We are the only platform that takes analytics and reporting and turns them into actionable insights.
Easy to use, automated consolidation solution includes intercompany eliminations, group currency and currency conversion, intercompany loan eliminations, and more.  Customizable reporting at any level, including class, location, group, or subsidiary.",Simple monthly subscription based solution. No hidden fees or support charges!  Unlimited classes & locations included.,"[{'plan-name': 'Reporting', 'details': 'Automated integration to Quickbooks Online and Desktop. Includes standard financial statements and reports in your practice- and client portals. 1 customer user included, 5 Free Customers, + $10 per additional customer user, unlimited partner users.', 'users': '1', 'price': '$ 10 a month'}, {'plan-name': 'Consolidation', 'details': 'Same as Platform + Consolidation Reports, Eliminations, Group currency, Automatic Currency Conversion, 10 legal entities included, + $20 per additional customer user', 'users': '1', 'price': '$ 100 a month'}, {'plan-name': 'Analytics', 'details': 'Everything in Reporting + industry analytics, bechmarks, financial ratios, cashflow forecast - everything created for your advisory services.', 'users': '1', 'price': '$ 25 a month'}]","[{'name': 'Syft Analytics', 'tag-line': 'Reports | Graphs | Consolidations | Forecasts | Valuations | Benchmark | Classes', 'url': 'https://quickbooks.intuit.com/app/apps/appdetails/syft'}, {'name': 'Reach Reporting - Analytics, Report Builder, Dashboards, Consolidations, Classes', 'tag-line': 'Financial Reporting, Classes, Consolidations, Dashboards, Performance Analytics', 'url': 'https://quickbooks.intuit.com/app/apps/appdetails/reach_reporting'}, {'name': 'Fathom', 'tag-line': 'Insightful dashboards and performance reports for your business.', 'url': 'https://quickbooks.intuit.com/app/apps/appdetails/fathom'}, {'name': 'Qvinci - Consolidation, BI, KPIs and Financial Reporting', 'tag-line': '#1 Reporting App in the Intuit Store', 'url': 'https://quickbooks.intuit.com/app/apps/appdetails/qvinci'}]","[{'question': 'Is it possible to integrate MoreReporting with QuickBooks automatically?', 'answer': 'After your company has registered with MoreReporting you will be able to authorize the automated integration of QuickBooks data using your username and password.'}, {'question': 'Can MoreReporting help me identify upsell opportunities with existing customers?', 'answer': ""The business health report is an automated in-depth analysis of your customers financial status including the book keeping, balance sheet, fraud detection and much more. It's designed to help you identify new upsell opportunities for your customers.""}, {'question': 'Is it possible to setup a budget to validate performance and progress?', 'answer': ""With the help of sophisticated algorithms, MoreReporting automatically analyzes the financial results from the past 3 years to predict or forecast a high-end budget that can be adjusted to easily reflect planned goals and KPI's. Smart Budget is used to validate performance and alerts if deviations occur.""}, {'question': 'Is it possible to consolidate financial results from two or more legal entities automatically?', 'answer': 'If you have 2 or more companies in your group a major problem is consolidating the financial results from each unit into an overall group report. MoreReporting can consolidate your financial figures with a few clicks including handling the elimination of intercompany transactions on account level. If you are operating in markets with different currencies MoreReporting can automatically convert the local currencies to your group currency.'}]",2021-11-04,08:39:36 AM
3,3,https://quickbooks.intuit.com/app/apps/appdetails/fundbox,https://attachments.developer.intuit.com/appcard-45ccb414-bd63-4e26-ae6e-cd40f67b5658.png,https://www.youtube.com/embed/AtbrJh_uVXE?rel=0,Fundbox,Get access to credit to fund your company's future.,Get Funded,4.4,1108,Fundbox,https://fundbox.com,(855) 572-7707,yourfriends@fundbox.com,http://help.fundbox.com,"Fundbox gives businesses like yours access to credit. They've removed the barriers surrounding the traditional credit process to offer you a streamlined way to fund your future. With their simple application, fast decisions, and transparent pricing, you can quickly find out if you're approved for a revolving line of credit. Fundbox is a direct path to the financial resources you need to grow, and they're here to help you reach your goals.","Apply in two easy steps. First, click ""Get App Now"" and Fundbox will automatically connect with QBO. Then, just verify your business details. We'll review the information in your QuickBooks account and make a credit decision. We do not store your login credentials and applying will not affect your credit score. If approved, draw funds anytime. They'll transfer as soon as the next business day. You can use your credit within QBO. Just click on the ""Transactions"" tab, choose ""Sales,"" click ""Advance Payment,"" and select an unpaid invoice. Only pay when you draw. Pay early and save.","Move fast, confidently: 
Apply and you can get a credit decision in minutes. Funds transfer as soon as the next business day.
We keep it simple: 
Draw funds from your dashboard. They arrive in your business bank account.
You're in control:
Pay early and save. Always see your payment total before you commit. No confusing language.","Apply for FREE.  No obligations.""The fees are absurdly low..""- Lara.C, BWDPricing starts at 4.66% of the invoice value.","[{'plan-name': 'Advancing invoices', 'details': 'Fees start at 4.66% of the invoice value and are spread over 12 or 24 weeks.', 'users': '1', 'price': 'Price is set per invoice'}]","[{'name': 'BlueVine', 'tag-line': 'Fast & Flexible Funding for Everyday Needs', 'url': 'https://quickbooks.intuit.com/app/apps/appdetails/bluevine'}, {'name': 'QuickBooks Capital', 'tag-line': 'QuickBooks Capital from Intuit makes it easy to find business funding.', 'url': 'https://quickbooks.intuit.com/app/apps/appdetails/quickbookscapital'}, {'name': 'FundThrough Invoice Financing', 'tag-line': 'Get outstanding customer invoices paid fast. Then, put your money to work.', 'url': 'https://quickbooks.intuit.com/app/apps/appdetails/FundThrough'}, {'name': 'Aion - Business Financials Platform', 'tag-line': 'Low cost short term business funds. Every business gets the same low rate.', 'url': 'https://quickbooks.intuit.com/app/apps/appdetails/Aion'}]","[{'question': 'How much does Fundbox cost?', 'answer': 'After you draw funds, you’ll repay that amount, plus interest—which starts at 4.66% of the amount drawn. Your interest may vary over time, but you’ll always know what it is before you draw. Pay us back early and we’ll waive the remaining interest. You only pay when you draw funds.'}, {'question': 'Who is eligible for Fundbox credit?', 'answer': 'To qualify, you should have a history of at least 3 months in a business checking account, or 2 months in an approved accounting software with ideally $50,000 or more in revenue.'}, {'question': 'I have a few more questions. Can I talk to someone?', 'answer': 'Sure, just give us a call at (855) 572-7707 and one of our team members will help you out.'}]",2021-11-04,08:39:36 AM
4,4,https://quickbooks.intuit.com/app/apps/appdetails/bluevine,https://attachments.developer.intuit.com/appcard-c3f4bdd4-e877-405f-9ee4-91f695613a75.png,,BlueVine,Fast & Flexible Funding for Everyday Needs,Get Funded,4.5,381,Bluevine Capital Inc.,https://www.bluevine.com,(888) 769-2028,,https://www.bluevine.com/contact-us/,"We were carefully selected from hundreds of lenders, so you can proceed with confidence.",BlueVine’s business line of credit offers you an everyday financing solution you can use  for  growing and managing your business. “A great option for small businesses that need cash” –Mary Raimondi QuickBooks Pro Advisor,,"Sign-up for free. No commitment. No application, subscription or set-up fees. No credit card required.","[{'plan-name': 'Standard', 'details': 'Our business line of credit product lets you draw funds whenever you need and is repaid over six months with interest fees as low as 6.9%.', 'users': '1', 'price': 'Per draw or per invoice'}]","[{'name': 'Fundbox', 'tag-line': ""Get access to credit to fund your company's future."", 'url': 'https://quickbooks.intuit.com/app/apps/appdetails/fundbox'}, {'name': 'QuickBooks Capital', 'tag-line': 'QuickBooks Capital from Intuit makes it easy to find business funding.', 'url': 'https://quickbooks.intuit.com/app/apps/appdetails/quickbookscapital'}, {'name': 'FundThrough Invoice Financing', 'tag-line': 'Get outstanding customer invoices paid fast. Then, put your money to work.', 'url': 'https://quickbooks.intuit.com/app/apps/appdetails/FundThrough'}, {'name': 'Aion - Business Financials Platform', 'tag-line': 'Low cost short term business funds. Every business gets the same low rate.', 'url': 'https://quickbooks.intuit.com/app/apps/appdetails/Aion'}]","[{'question': ""What are the benefits of using BlueVine's business line of credit?"", 'answer': 'A business line of credit gives you the ability to access funding when you want, up to your credit limit.  And unlike a traditional merchant cash advance or cash flow loan that is one-time, BlueVine’s Flex Credit is “revolving credit.”  This means that as you repay back your outstanding funds your available credit replenishes, and you can draw additional funds again as you like.'}, {'question': 'What are the minimum requirements for the Line of Credit product?', 'answer': '600+ FICO, 6+ months in business, $1,000+ average monthly bank balance, $5,000+ monthly revenue'}, {'question': 'Do you serve all 50 states?', 'answer': 'Due to regulations, we cannot provide lines of credit in the following states: Kentucky, Nevada, New Hampshire, North Dakota, South Dakota, Tennessee, Vermont'}, {'question': 'What kinds of companies use BlueVine?', 'answer': 'Our solution is trusted by thousands of businesses owners and hundreds of industries across the country. We are rated 5 stars on the Intuit App Center, A+ rated by the BBB and rated 5 stars on TrustPilot. It costs nothing to apply and there are no monthly subscription fees or minimums. You only pay for the funds you use.'}]",2021-11-04,08:39:36 AM
5,5,https://quickbooks.intuit.com/app/apps/appdetails/quickbookscapital,https://attachments.developer.intuit.com/appcard-febe3ef8-04ef-439b-a576-4e841c069f49.png,,QuickBooks Capital,QuickBooks Capital from Intuit makes it easy to find business funding.,Get Funded,4.8,57,Intuit Inc.,https://quickbookscapital.intuit.com,1-844-848-0430,,http://quickbookscapital.intuit.com,Compare rates on a wide range of funding options from our partners without affecting your credit.,QuickBooks Capital from Intuit uses your QuickBooks data to find the right funding at the best rates to grow your business.   We work with trusted partners to make it easy to match you with the right provider and get funding in as fast as one day.,Work with financing partners committed to providing transparent and competitive rates.,Free,"[{'plan-name': 'Free', 'details': 'Free', 'users': '1', 'price': '$0'}]","[{'name': 'Fundbox', 'tag-line': ""Get access to credit to fund your company's future."", 'url': 'https://quickbooks.intuit.com/app/apps/appdetails/fundbox'}, {'name': 'BlueVine', 'tag-line': 'Fast & Flexible Funding for Everyday Needs', 'url': 'https://quickbooks.intuit.com/app/apps/appdetails/bluevine'}, {'name': 'FundThrough Invoice Financing', 'tag-line': 'Get outstanding customer invoices paid fast. Then, put your money to work.', 'url': 'https://quickbooks.intuit.com/app/apps/appdetails/FundThrough'}, {'name': 'Aion - Business Financials Platform', 'tag-line': 'Low cost short term business funds. Every business gets the same low rate.', 'url': 'https://quickbooks.intuit.com/app/apps/appdetails/Aion'}]","[{'question': 'How much does it cost for me to use QuickBooks Capital?', 'answer': ""It’s completely free for small businesses. We don't charge you any fees to use our matching service. If you are matched with one of our financial solution providers and you decide to use them to obtain funding, you will be responsible for any interest and fees charged by them.""}, {'question': 'Why would I use QuickBooks Capital instead of my personal bank?', 'answer': 'Because your personal bank is just one bank among many across the country. Here at QuickBooks Capital, we cast a wide net across trusted partners across the country. This ensures you can find the one that best matches your business profile and funding needs.'}, {'question': 'Is this going to affect my credit score?', 'answer': ""Nope. We wouldn't do anything that would hurt your chances of getting money. When we ask you to provide us your information to see your offers, we do a “soft inquiry” which will not impact your credit score. It's so that we can use it (among many other factors) to help find you the right funding options. But keep in mind, that if you do choose one of those options, financial institutions are required by law to pull your credit before approving you for a financial solution.""}, {'question': 'Is my information secure?', 'answer': 'Security is a top priority for us here at Intuit. We use industry standard encryption technology and firewall protection to handle your information. From TurboTax to QuickBooks we securely deal with millions of pieces of sensitive data for our users around the world. In fact, we think your data might be more secure with us.'}]",2021-11-04,08:39:36 AM
